### ISSUE TITLE
dut-network: enhancement local NTP responder

### ISSUE THREAD

**Issue by mangelajo** [jumpstarter-dev/jumpstarter#667]
Our labs don't have access to external NTPs, we could add a config switch `local_ntp` to the DUT network driver that does several things:

1) redirect all NTP driver to a local ntp server, i.e. 192.168.100.1 or main interface ip..
2) start the most minimal ntp server

benefit, this would work:

```
06:33:03.293322 IP 192.168.100.125.40344 > 23.150.41.123.123: NTPv4, Client, length 48
06:33:03.459879 IP 192.168.100.125.49570 > 96.245.170.99.123: NTPv4, Client, length 48
06:33:03.663148 IP 192.168.100.125.58769 > 66.118.230.14.123: NTPv4, Client, length 48
06:33:03.865916 IP 192.168.100.125.52760 > 108.61.215.221.123: NTPv4, Client, length 48
06:33:04.891890 ARP, Request who-has 192.168.100.125 tell 192.168.100.125, length 46
06:33:05.332385 IP 192.168.100.125.43132 > 23.150.41.123.123: NTPv4, Client, length 48
06:33:05.533930 IP 192.168.100.125.34866 > 96.245.170.99.123: NTPv4, Client, length 48
06:33:05.734765 IP 192.168.100.125.44992 > 66.118.230.14.123: NTPv4, Client, length 48
06:33:05.938152 IP 192.168.100.125.49148 > 108.61.215.221.123: NTPv4, Client, length 48
06:33:06.892440 ARP, Request who-has 192.168.100.125 tell 192.168.100.125, length 46
06:33:07.343421 IP 192.168.100.125.60240 > 23.150.41.123.123: NTPv4, Client, length 48
06:33:07.552007 IP 192.168.100.125.36747 > 96.245.170.99.123: NTPv4, Client, length 48
06:33:07.762614 IP 192.168.100.125.47524 > 66.118.230.14.123: NTPv4, Client, length 48
06:33:07.962683 IP 192.168.100.125.48639 > 108.61.215.221.123: NTPv4, Client, length 48
06:33:08.036874 ARP, Request who-has 192.168.100.125 tell 192.168.100.1, length 28
06:33:08.037948 ARP, Reply 192.168.100.125 is-at 4a:7c:9d:03:7e:6a, length 46
06:33:09.370647 IP 192.168.100.125.37454 > 23.150.41.123.123: NTPv4, Client, length 48
```

**Comment by mangelajo** [comment]
We need a very simple responder on the interface main address, would just listening and responding in python work? we don't need ultra precise ntp here, this could be added later by using chrony or similar, but that's more complex to wire.

**Comment by raballew** [comment]
@mangelajo Same goes for TFTP, DHCP, DNS, ... An the exporters NTP server would then be synced with the clusters NTP (different strates iirc)? Could we also look at PTP? Another interesting approach here could be if the exporter would be a multihomed node in the cluster and the DUTs network would be accessed through multus with those network services merely being (multus)pods on the cluster
